11:38:55.874656 IP 10.0.0.2.60951 > 10.0.0.1.5001: UDP, length 1448
11:38:55.876732 IP 10.0.0.2.60951 > 10.0.0.1.5001: UDP, length 1448
11:38:55.881214 IP 10.0.0.2.60951 > 10.0.0.1.5001: UDP, length 1448
11:38:55.886492 IP 10.0.0.2.60951 > 10.0.0.1.5001: UDP, length 1448
11:38:55.891143 IP 10.0.0.2.60951 > 10.0.0.1.5001: UDP, length 1448
11:38:55.895873 IP 10.0.0.2.60951 > 10.0.0.1.5001: UDP, length 1448
11:38:55.901362 IP 10.0.0.2.60951 > 10.0.0.1.5001: UDP, length 1448
11:38:55.905434 IP 10.0.0.2.60951 > 10.0.0.1.5001: UDP, length 1448
11:38:55.910279 IP 10.0.0.2.60951 > 10.0.0.1.5001: UDP, length 1448
11:38:55.915262 IP 10.0.0.2.60951 > 10.0.0.1.5001: UDP, length 1448
11:38:55.919934 IP 10.0.0.2.60951 > 10.0.0.1.5001: UDP, length 1448
11:38:55.924659 IP 10.0.0.2.60951 > 10.0.0.1.5001: UDP, length 1448
11:38:55.929689 IP 10.0.0.2.60951 > 10.0.0.1.5001: UDP, length 1448
11:38:55.934185 IP 10.0.0.2.60951 > 10.0.0.1.5001: UDP, length 1448
11:38:55.938815 IP 10.0.0.2.60951 > 10.0.0.1.5001: UDP, length 1448
11:38:55.943670 IP 10.0.0.2.60951 > 10.0.0.1.5001: UDP, length 1448
11:38:55.948470 IP 10.0.0.2.60951 > 10.0.0.1.5001: UDP, length 1448
11:38:55.953236 IP 10.0.0.2.60951 > 10.0.0.1.5001: UDP, length 1448
11:38:55.958275 IP 10.0.0.2.60951 > 10.0.0.1.5001: UDP, length 1448
11:38:55.962931 IP 10.0.0.2.60951 > 10.0.0.1.5001: UDP, length 1448
11:38:55.967593 IP 10.0.0.2.60951 > 10.0.0.1.5001: UDP, length 1448
11:38:55.972521 IP 10.0.0.2.60951 > 10.0.0.1.5001: UDP, length 1448
11:38:55.977214 IP 10.0.0.2.60951 > 10.0.0.1.5001: UDP, length 1448
11:38:55.982203 IP 10.0.0.2.60951 > 10.0.0.1.5001: UDP, length 1448
11:38:55.986808 IP 10.0.0.2.60951 > 10.0.0.1.5001: UDP, length 1448
11:38:55.991673 IP 10.0.0.2.60951 > 10.0.0.1.5001: UDP, length 1448
11:38:55.996354 IP 10.0.0.2.60951 > 10.0.0.1.5001: UDP, length 1448
11:38:56.001345 IP 10.0.0.2.60951 > 10.0.0.1.5001: UDP, length 1448
11:38:56.006023 IP 10.0.0.2.60951 > 10.0.0.1.5001: UDP, length 1448
11:38:56.010930 IP 10.0.0.2.60951 > 10.0.0.1.5001: UDP, length 1448
