15:39:44.453677 IP 10.0.0.3.5001 > 10.0.0.4.44206: Flags [.], ack 1754210085, win 4763, options [nop,nop,TS val 721029070 ecr 687327748], length 0
15:39:44.463739 IP 10.0.0.4.44206 > 10.0.0.3.5001: Flags [P.], seq 1:2897, ack 0, win 83, options [nop,nop,TS val 687327760 ecr 721029033], length 2896
15:39:44.468847 IP 10.0.0.4.44206 > 10.0.0.3.5001: Flags [P.], seq 2897:5793, ack 0, win 83, options [nop,nop,TS val 687327760 ecr 721029033], length 2896
15:39:44.468862 IP 10.0.0.3.5001 > 10.0.0.4.44206: Flags [.], ack 2897, win 4944, options [nop,nop,TS val 721029090 ecr 687327760], length 0
15:39:44.471805 IP 10.0.0.3.5001 > 10.0.0.4.44206: Flags [.], ack 5793, win 5125, options [nop,nop,TS val 721029095 ecr 687327760], length 0
15:39:44.471792 IP 10.0.0.4.44206 > 10.0.0.3.5001: Flags [P.], seq 5793:8689, ack 0, win 83, options [nop,nop,TS val 687327763 ecr 721029038], length 2896
15:39:44.474532 IP 10.0.0.3.5001 > 10.0.0.4.44206: Flags [.], ack 8689, win 5306, options [nop,nop,TS val 721029099 ecr 687327763], length 0
15:39:44.474538 IP 10.0.0.4.44206 > 10.0.0.3.5001: Flags [P.], seq 11585:14481, ack 0, win 83, options [nop,nop,TS val 687327765 ecr 721029041], length 2896
15:39:44.475971 IP 10.0.0.3.5001 > 10.0.0.4.44206: Flags [.], ack 8689, win 5487, options [nop,nop,TS val 721029101 ecr 687327763,nop,nop,sack 1 {11585:14481}], length 0
15:39:44.475969 IP 10.0.0.4.44206 > 10.0.0.3.5001: Flags [P.], seq 14481:17377, ack 0, win 83, options [nop,nop,TS val 687327765 ecr 721029041], length 2896
15:39:44.477084 IP 10.0.0.3.5001 > 10.0.0.4.44206: Flags [.], ack 8689, win 5668, options [nop,nop,TS val 721029102 ecr 687327763,nop,nop,sack 1 {11585:17377}], length 0
15:39:44.477362 IP 10.0.0.4.44206 > 10.0.0.3.5001: Flags [P.], seq 17377:20273, ack 0, win 83, options [nop,nop,TS val 687327776 ecr 721029043], length 2896
15:39:44.478474 IP 10.0.0.3.5001 > 10.0.0.4.44206: Flags [.], ack 8689, win 5849, options [nop,nop,TS val 721029104 ecr 687327763,nop,nop,sack 1 {11585:20273}], length 0
15:39:44.479924 IP 10.0.0.4.44206 > 10.0.0.3.5001: Flags [P.], seq 23169:26065, ack 0, win 83, options [nop,nop,TS val 687327778 ecr 721029047], length 2896
15:39:44.481193 IP 10.0.0.3.5001 > 10.0.0.4.44206: Flags [.], ack 8689, win 6030, options [nop,nop,TS val 721029106 ecr 687327763,nop,nop,sack 2 {23169:26065}{11585:20273}], length 0
15:39:44.482604 IP 10.0.0.4.44206 > 10.0.0.3.5001: Flags [P.], seq 26065:28961, ack 0, win 83, options [nop,nop,TS val 687327778 ecr 721029047], length 2896
15:39:44.483813 IP 10.0.0.3.5001 > 10.0.0.4.44206: Flags [.], ack 8689, win 6211, options [nop,nop,TS val 721029109 ecr 687327763,nop,nop,sack 2 {23169:28961}{11585:20273}], length 0
15:39:44.484484 IP 10.0.0.4.44206 > 10.0.0.3.5001: Flags [P.], seq 28961:31857, ack 0, win 83, options [nop,nop,TS val 687327795 ecr 721029050], length 2896
15:39:44.485601 IP 10.0.0.3.5001 > 10.0.0.4.44206: Flags [.], ack 8689, win 6392, options [nop,nop,TS val 721029111 ecr 687327763,nop,nop,sack 2 {23169:31857}{11585:20273}], length 0
15:39:44.488281 IP 10.0.0.4.44206 > 10.0.0.3.5001: Flags [P.], seq 31857:34753, ack 0, win 83, options [nop,nop,TS val 687327795 ecr 721029050], length 2896
15:39:44.489390 IP 10.0.0.3.5001 > 10.0.0.4.44206: Flags [.], ack 8689, win 6573, options [nop,nop,TS val 721029115 ecr 687327763,nop,nop,sack 2 {23169:34753}{11585:20273}], length 0
15:39:44.490493 IP 10.0.0.4.44206 > 10.0.0.3.5001: Flags [P.], seq 40545:43441, ack 0, win 83, options [nop,nop,TS val 687327805 ecr 721029063], length 2896
15:39:44.491598 IP 10.0.0.3.5001 > 10.0.0.4.44206: Flags [.], ack 8689, win 6754, options [nop,nop,TS val 721029117 ecr 687327763,nop,nop,sack 3 {40545:43441}{23169:34753}{11585:20273}], length 0
15:39:44.494137 IP 10.0.0.4.44206 > 10.0.0.3.5001: Flags [P.], seq 43441:46337, ack 0, win 83, options [nop,nop,TS val 687327805 ecr 721029063], length 2896
15:39:44.495424 IP 10.0.0.3.5001 > 10.0.0.4.44206: Flags [.], ack 8689, win 6935, options [nop,nop,TS val 721029120 ecr 687327763,nop,nop,sack 3 {40545:46337}{23169:34753}{11585:20273}], length 0
15:39:44.496528 IP 10.0.0.4.44206 > 10.0.0.3.5001: Flags [P.], seq 52129:55025, ack 0, win 83, options [nop,nop,TS val 687327814 ecr 721029070], length 2896
15:39:44.497635 IP 10.0.0.3.5001 > 10.0.0.4.44206: Flags [.], ack 8689, win 7116, options [nop,nop,TS val 721029123 ecr 687327763,nop,nop,sack 3 {52129:55025}{40545:46337}{23169:34753}], length 0
15:39:44.500156 IP 10.0.0.4.44206 > 10.0.0.3.5001: Flags [P.], seq 63713:66609, ack 0, win 83, options [nop,nop,TS val 687327820 ecr 721029095], length 2896
15:39:44.501366 IP 10.0.0.3.5001 > 10.0.0.4.44206: Flags [.], ack 8689, win 7297, options [nop,nop,TS val 721029126 ecr 687327763,nop,nop,sack 3 {63713:66609}{52129:55025}{40545:46337}], length 0
15:39:44.503785 IP 10.0.0.4.44206 > 10.0.0.3.5001: Flags [P.], seq 75297:78193, ack 0, win 83, options [nop,nop,TS val 687327824 ecr 721029101], length 2896
