15:39:44.471799 IP 10.0.0.2.49122 > 10.0.0.1.5001: UDP, length 1448
15:39:44.472240 IP 10.0.0.2.49122 > 10.0.0.1.5001: UDP, length 1448
15:39:44.472243 IP 10.0.0.2.49122 > 10.0.0.1.5001: UDP, length 1448
15:39:44.475975 IP 10.0.0.2.49122 > 10.0.0.1.5001: UDP, length 1448
15:39:44.476635 IP 10.0.0.2.49122 > 10.0.0.1.5001: UDP, length 1448
15:39:44.481940 IP 10.0.0.2.49122 > 10.0.0.1.5001: UDP, length 1448
15:39:44.487181 IP 10.0.0.2.49122 > 10.0.0.1.5001: UDP, length 1448
15:39:44.492187 IP 10.0.0.2.49122 > 10.0.0.1.5001: UDP, length 1448
15:39:44.497199 IP 10.0.0.2.49122 > 10.0.0.1.5001: UDP, length 1448
15:39:44.502208 IP 10.0.0.2.49122 > 10.0.0.1.5001: UDP, length 1448
15:39:44.507152 IP 10.0.0.2.49122 > 10.0.0.1.5001: UDP, length 1448
15:39:44.512575 IP 10.0.0.2.49122 > 10.0.0.1.5001: UDP, length 1448
15:39:44.517375 IP 10.0.0.2.49122 > 10.0.0.1.5001: UDP, length 1448
15:39:44.522314 IP 10.0.0.2.49122 > 10.0.0.1.5001: UDP, length 1448
15:39:44.527020 IP 10.0.0.2.49122 > 10.0.0.1.5001: UDP, length 1448
15:39:44.531811 IP 10.0.0.2.49122 > 10.0.0.1.5001: UDP, length 1448
15:39:44.536751 IP 10.0.0.2.49122 > 10.0.0.1.5001: UDP, length 1448
15:39:44.541504 IP 10.0.0.2.49122 > 10.0.0.1.5001: UDP, length 1448
15:39:44.546291 IP 10.0.0.2.49122 > 10.0.0.1.5001: UDP, length 1448
15:39:44.550956 IP 10.0.0.2.49122 > 10.0.0.1.5001: UDP, length 1448
15:39:44.556624 IP 10.0.0.2.49122 > 10.0.0.1.5001: UDP, length 1448
15:39:44.560689 IP 10.0.0.2.49122 > 10.0.0.1.5001: UDP, length 1448
15:39:44.565468 IP 10.0.0.2.49122 > 10.0.0.1.5001: UDP, length 1448
15:39:44.570508 IP 10.0.0.2.49122 > 10.0.0.1.5001: UDP, length 1448
15:39:44.575015 IP 10.0.0.2.49122 > 10.0.0.1.5001: UDP, length 1448
15:39:44.580178 IP 10.0.0.2.49122 > 10.0.0.1.5001: UDP, length 1448
15:39:44.584866 IP 10.0.0.2.49122 > 10.0.0.1.5001: UDP, length 1448
15:39:44.589460 IP 10.0.0.2.49122 > 10.0.0.1.5001: UDP, length 1448
15:39:44.594333 IP 10.0.0.2.49122 > 10.0.0.1.5001: UDP, length 1448
15:39:44.598990 IP 10.0.0.2.49122 > 10.0.0.1.5001: UDP, length 1448
