11:38:55.832066 IP 10.0.0.4.42656 > 10.0.0.3.5001: Flags [S], seq 2145984771, win 42340, options [mss 1460,sackOK,TS val 672879161 ecr 0,nop,wscale 9], length 0
11:38:55.833495 IP 10.0.0.3.5001 > 10.0.0.4.42656: Flags [S.], seq 2482547293, ack 2145984772, win 65535, options [mss 1460,sackOK,TS val 706580458 ecr 672879161,nop,wscale 5], length 0
11:38:55.853760 IP 10.0.0.4.42656 > 10.0.0.3.5001: Flags [.], ack 1, win 83, options [nop,nop,TS val 672879184 ecr 706580458], length 0
11:38:55.854036 IP 10.0.0.4.42656 > 10.0.0.3.5001: Flags [.], seq 1:1449, ack 1, win 83, options [nop,nop,TS val 672879184 ecr 706580458], length 1448
11:38:55.854038 IP 10.0.0.4.42656 > 10.0.0.3.5001: Flags [P.], seq 1449:2897, ack 1, win 83, options [nop,nop,TS val 672879184 ecr 706580458], length 1448
11:38:55.855873 IP 10.0.0.4.42656 > 10.0.0.3.5001: Flags [.], seq 2897:4345, ack 1, win 83, options [nop,nop,TS val 672879184 ecr 706580458], length 1448
11:38:55.855889 IP 10.0.0.3.5001 > 10.0.0.4.42656: Flags [.], ack 1449, win 2139, options [nop,nop,TS val 706580481 ecr 672879184], length 0
11:38:55.855891 IP 10.0.0.3.5001 > 10.0.0.4.42656: Flags [.], ack 2897, win 2229, options [nop,nop,TS val 706580481 ecr 672879184], length 0
11:38:55.855874 IP 10.0.0.4.42656 > 10.0.0.3.5001: Flags [P.], seq 4345:5793, ack 1, win 83, options [nop,nop,TS val 672879184 ecr 706580458], length 1448
11:38:55.857532 IP 10.0.0.3.5001 > 10.0.0.4.42656: Flags [.], ack 4345, win 2320, options [nop,nop,TS val 706580482 ecr 672879184], length 0
11:38:55.857551 IP 10.0.0.3.5001 > 10.0.0.4.42656: Flags [.], ack 5793, win 2410, options [nop,nop,TS val 706580482 ecr 672879184], length 0
11:38:55.857528 IP 10.0.0.4.42656 > 10.0.0.3.5001: Flags [P.], seq 5793:8689, ack 1, win 83, options [nop,nop,TS val 672879184 ecr 706580458], length 2896
11:38:55.860362 IP 10.0.0.3.5001 > 10.0.0.4.42656: Flags [.], ack 8689, win 2591, options [nop,nop,TS val 706580484 ecr 672879184], length 0
11:38:55.860369 IP 10.0.0.4.42656 > 10.0.0.3.5001: Flags [P.], seq 8689:11585, ack 1, win 83, options [nop,nop,TS val 672879184 ecr 706580458], length 2896
11:38:55.862156 IP 10.0.0.3.5001 > 10.0.0.4.42656: Flags [.], ack 11585, win 2772, options [nop,nop,TS val 706580487 ecr 672879184], length 0
11:38:55.862162 IP 10.0.0.4.42656 > 10.0.0.3.5001: Flags [P.], seq 11585:14481, ack 1, win 83, options [nop,nop,TS val 672879184 ecr 706580458], length 2896
11:38:55.864116 IP 10.0.0.3.5001 > 10.0.0.4.42656: Flags [.], ack 14481, win 2953, options [nop,nop,TS val 706580488 ecr 672879184], length 0
11:38:55.874625 IP 10.0.0.4.42656 > 10.0.0.3.5001: Flags [P.], seq 14481:17377, ack 1, win 83, options [nop,nop,TS val 672879204 ecr 706580481], length 2896
11:38:55.876309 IP 10.0.0.3.5001 > 10.0.0.4.42656: Flags [.], ack 17377, win 3134, options [nop,nop,TS val 706580501 ecr 672879204], length 0
11:38:55.875883 IP 10.0.0.4.42656 > 10.0.0.3.5001: Flags [P.], seq 17377:20273, ack 1, win 83, options [nop,nop,TS val 672879204 ecr 706580481], length 2896
11:38:55.877735 IP 10.0.0.3.5001 > 10.0.0.4.42656: Flags [.], ack 20273, win 3315, options [nop,nop,TS val 706580503 ecr 672879204], length 0
11:38:55.878070 IP 10.0.0.4.42656 > 10.0.0.3.5001: Flags [P.], seq 20273:23169, ack 1, win 83, options [nop,nop,TS val 672879207 ecr 706580482], length 2896
11:38:55.879358 IP 10.0.0.3.5001 > 10.0.0.4.42656: Flags [.], ack 23169, win 3496, options [nop,nop,TS val 706580504 ecr 672879207], length 0
11:38:55.880398 IP 10.0.0.4.42656 > 10.0.0.3.5001: Flags [P.], seq 23169:26065, ack 1, win 83, options [nop,nop,TS val 672879207 ecr 706580482], length 2896
11:38:55.881650 IP 10.0.0.3.5001 > 10.0.0.4.42656: Flags [.], ack 26065, win 3677, options [nop,nop,TS val 706580507 ecr 672879207], length 0
11:38:55.883956 IP 10.0.0.4.42656 > 10.0.0.3.5001: Flags [P.], seq 26065:28961, ack 1, win 83, options [nop,nop,TS val 672879209 ecr 706580484], length 2896
11:38:55.885195 IP 10.0.0.3.5001 > 10.0.0.4.42656: Flags [.], ack 28961, win 3858, options [nop,nop,TS val 706580510 ecr 672879209], length 0
11:38:55.886489 IP 10.0.0.4.42656 > 10.0.0.3.5001: Flags [P.], seq 28961:31857, ack 1, win 83, options [nop,nop,TS val 672879209 ecr 706580484], length 2896
11:38:55.888234 IP 10.0.0.3.5001 > 10.0.0.4.42656: Flags [.], ack 31857, win 4039, options [nop,nop,TS val 706580513 ecr 672879209], length 0
11:38:55.888702 IP 10.0.0.4.42656 > 10.0.0.3.5001: Flags [P.], seq 31857:34753, ack 1, win 83, options [nop,nop,TS val 672879214 ecr 706580487], length 2896
